2024/03/22 11:16:23 am EET,xxxxxx@xxx.xxx,xxxxxx,Use case provider,WP1 - Use Cases Analysis and AIDOaRT Solution Architecture;WP2 - AIDoaRT Data Collection and Representation;WP3 - AIDOaRT Infrastructure and Framework;WP4 - AIDOaRT AI-augmented toolkit;WP5 - Integration and Use Case Evaluation;WP6 - Dissemination and Exploitation;WP7 - Project Management and Coordination,"In AIDOaRt we work mainly with UNISS (University) and INT (Large enterprise), but our partners can vary a lot depending on the research project. ",1-3 years,1-3 years,1-3 years,xxxxxx,Automotive,Technological achievements;Improvements in competence or experience;New knowledge;Cooperations or collaborations,"Academic tools often do not meet the the company needs or way of working. Different sessions with UNISS have been carried out, to iterate on our respective needs and find a trade-off among academic and industrial world.

 ","The usage of FPGAs boards is not straightforward, since it required a long learning curve.  We are still working on them. ",3,3,5,,4,,5,,4,,3,"I honestly still do not understand the purpose and usage of the so called ""functional interfaces"" defined in AIDOaRt",2,"Actually not, requirements are not always mapped directly to KPIs ",No,,Yes,,Yes,,"Neutral. It wasn't really necessary to use a model in our UC, but working on it helped us to better understand the UC needs and information flow","Good. It forced us to really think about our needs. Also, the solutions we exploited are related to requirements verification, thus really on topic. ",Neutral,Good. This is really the core of our UC. ,Neutral. It wasn't really a need for our UC,Neutral,I didn't really like the micro-management approach based on microtasks. I found it not compliant with our normal way of working.,"Yes, activities and collaborations in AIDOaRt led to new EU project proposals currently ongoing. "
2024/03/22 12:36:52 pm EET,xxxxxx@xxx.xxx,xxxxxx,Use case provider;Solution provider,WP1 - Use Cases Analysis and AIDOaRT Solution Architecture;WP2 - AIDoaRT Data Collection and Representation;WP4 - AIDOaRT AI-augmented toolkit;WP5 - Integration and Use Case Evaluation;WP6 - Dissemination and Exploitation,Large Industry,3-5 years,10-15 years,3-5 years,xxxxxx,Automotive;Railway,Industrial applications;Technological achievements;Improvements in competence or experience;Cooperations or collaborations,"Understanding the key challenges of the use case provider, overcome lack of data, evaluation criterias of concrete solution and industrial requirement - Strategies to overcome challenges: No specific ones except continous workshops (incl. hackathon challenges); definition of mitigation strategies in case of delays to minimize impact and ensure positive outcome; application of synthetic data where applicable",,3,3,4,Purpose of architecture is interpreted sometimes differently by partners and/or reviewers. ,3,,4,,4,,4,,4,,Yes,"Despite AVL was not a primarily solution provider, the collaboration as a solution provider with ALSTOM offers good insights in other domains and was very helpful to enhance the potential application field of AVL solutions.",Yes,Integration of AVL solution in other domains than traditional AVL domains (i.e. automotive) enhances AVLs knowledge about other domains (e.g. railway),Yes,Positive experiences as we ended up with very good PoC which are now entering several exploitation activities.,"Good Experience, as it helped to structure the project","Good experience, at it supports the discussion with partners and also the coordination of finding partners",N/A,"Very good experience, as this was the very core of all AVL Use Cases and Solutions","Difficult, as lack of data is a common issue if working with AI - synthetic das partially mitigate this issue","Partly good, at it helps to structurize the solutions and to find cross- and horizontal dependencies to other use cases",Horizontal collaboration nevertheless remain limited and should be more in the focus already in the starting phase of the project,"Absolutely, most beneficial example is the cross- and horizontal collaboration between AVL and VCE in sharing similar challeges. Also the collaboration with ALSTOM was not planned at the beginning of the project but evolved during the application of the AIDOaRt framework. Similar significant numbers of partner approached AVL and participated in their use cases, which have not been planned from the very beginning."
2024/03/25 2:50:37 pm EET,xxxxxx@xxx.xxx,xxxxxx,Solution provider,WP1 - Use Cases Analysis and AIDOaRT Solution Architecture;WP2 - AIDoaRT Data Collection and Representation;WP3 - AIDOaRT Infrastructure and Framework;WP4 - AIDOaRT AI-augmented toolkit;WP5 - Integration and Use Case Evaluation;WP6 - Dissemination and Exploitation,Research Institute,3-5 years,3-5 years,10-15 years,xxxxxx,Automotive,Technological achievements;New knowledge;Cooperations or collaborations,Application of machine learning approaches in industry: fitting the approach to the requirements,,4,4,4,,5,,4,,3,,4,,5,,Yes,,No,,Yes,,good: overview is accessible,good: requirements engineering on a model basis,-,good: generative AI is a promising new technology,-,The framework helped in finiding use case providers and therefore on defining the requried solution and its development.,,In fact we picked up generative AI for the automotive sector for test scenario parameter recommendation recuding the effort of ADAS testing significantly.
2024/03/26 4:21:36 pm EET,xxxxxx@xxx.xxx,xxxxxx,Solution provider,WP1 - Use Cases Analysis and AIDOaRT Solution Architecture;WP2 - AIDoaRT Data Collection and Representation;WP3 - AIDOaRT Infrastructure and Framework;WP4 - AIDOaRT AI-augmented toolkit;WP5 - Integration and Use Case Evaluation,SME Industry,3-5 years,5-10 years,10-15 years,xxxxxx,Railway;Digital Life,Industrial applications;Technological achievements;Improvements in competence or experience;New knowledge;Technical speed-up;Cooperations or collaborations;Publications,Acquiring data of sufficient volume and quality. This has been overcome by fine-tuning the model on multiple data sources and curating personal datasets that are carefully crafted with the high quality.,,5,5,5,,5,,5,,5,,5,,5,,Yes,,Yes,,Yes,,Great.,Great.,Good.,Great.,Data availability with the right amount and quality is challenging.,The AIDOaRt framework facilitated the integration within use cases and with other solutions.,,AIDOaRt helped us identify and realize various collaborations on three use cases and to exchange with several other solution providers. This would surely be resumed in subsequent common research project on other subjects and application domains.
2024/03/26 4:59:16 pm EET,xxxxxx@xxx.xxx,xxxxxx,Solution provider,WP4 - AIDOaRT AI-augmented toolkit,University,3-5 years,3-5 years,3-5 years,xxxxxx,Construction,Industrial applications;Publications,"We encountered two challenges in developing MORGAN, i.e., promoting the adoption of modeling practices in an industrial context, and supporting automation through the combination of MBSE practices and AI-based tools. To address the former, we propose a solution architecture that combines different solutions to increase interoperability using system modeling languages such as SysML or AutomationML. This enables domain experts to unify artifacts via shared models. To address the second challenge, we combine  MORGAN with the MER plugin to capture the modeling context thus providing modeling recommendations tailored to the modelers' active context. 
","We encountered two challenges in developing MORGAN, i.e., promoting the adoption of modeling practices in an industrial context, and supporting automation through the combination of MBSE practices and AI-based tools. To address the former, we propose a solution architecture that combines different solutions to increase interoperability using system modeling languages such as SysML or AutomationML. This enables domain experts to unify artifacts via shared models. To address the second challenge, we combine  MORGAN with the MER plugin to capture the modeling context thus providing modeling recommendations tailored to the modelers' active context. 
",4,5,4,The overall architecture was helpful to work collaboratively on the project. ,4,,3,"In this respect, hackathons were more helpful in finding new collaborations ",4,,4,,3,"In this respect, the KPI have been changed over the time due to the run-time constraints raised during the actual development",Yes,"The overall experience was good. Even though we adopt an existing solution, we applied MORGAN in an industrial use case, thus harnessing the practicality of the approach.  ",Yes,"Overall, we integrated the solution in VCE use case, combine it with another tool developed in the context of the project, i.e., MER tool proposed by JKU SP. ",No,,Good,Good,We didn't work in this specific aspect of the project,Good,"Bad, the data was not available in the developed use case",Good,Focusing on collecting data before devising the solutions can improve the process ,"Yes, the collaboration was reached during the hackathons. Althogether, we forseen different 
 future  collaborations in AI applied on industrial domain. "
2024/03/29 12:09:16 pm EET,xxxxxx@xxx.xxx,xxxxxx,Use case provider,WP1 - Use Cases Analysis and AIDOaRT Solution Architecture;WP5 - Integration and Use Case Evaluation;WP6 - Dissemination and Exploitation;WP7 - Project Management and Coordination,SME Industry,30+ years,10-15 years,1-3 years,xxxxxx,Automotive,Industrial applications;Improvements in competence or experience,"For using solutions, we changed the software development tools from propritary to free Eclipse-based. ",,4,4,4,The component view of AIDOaRt architecture was modeled following the WP2-WP3-WP4 organization.  ,4,,4,,4,The previous question doesn't apply to use case providers. ,4,The previous question doesn't apply to use case providers. ,4,,No,"TEKNE is a use case provider: it collaborated to solutions with requirements and validation, but it didn't developed any solution/tool. ",No,"The question is not clear (see also the next question): TEKNE used solutions in its use case, integrated solutions in its development process, but it didn't ""integrated a solution/tool in AIDOaRt"" because it is a use case provider. ",Yes,"TEKNE integrated in its use case the solutions of UCAN, UNIVAQ and ROTECH: good experiences for the support it received from the solution providers. ",Good. ,Some aspects could be improved.,Good. ,Good. ,Good. ,Very good. ,Early evaluation of more fruitful ways to follow. The task leader should be the main editor of all deliverables of the task. ,"The main idea that TEKNE followed is about testing in wide sense: early (from modeling phase for correcteness and performance) and automated (for models, for units, at run-time).  In other projects, TEKNE already collaborated with ROTECH and UNIVAQ. The latter previously had collaboration with UCAN, and showed to TEKNE the complementary of their tools. 
TEKNE consider to continue the collaboration with these three partners, with a progressive usage of the tools in its industrial development process as well as in other reserch projects. "
2024/04/02 1:00:55 pm EET,xxxxxx@xxx.xxx,xxxxxx,Use case provider;Solution provider,WP1 - Use Cases Analysis and AIDOaRT Solution Architecture;WP2 - AIDoaRT Data Collection and Representation;WP4 - AIDOaRT AI-augmented toolkit;WP5 - Integration and Use Case Evaluation;WP6 - Dissemination and Exploitation;WP7 - Project Management and Coordination,SME Industry,3-5 years,5-10 years,5-10 years,xxxxxx,Digital Life,Industrial applications;Improvements in competence or experience;Technical speed-up,"In developing the AI for requirements analysis in HI Iberia Requirements analysis (work corresponding to requirement HIB_R02) we had to work with very limited text to process for a NLP-intensive application (categorising requirements according to several cateories, assigning to developers). In total we had less than 200 base requirements to train the system, which yielded bad results.","The main issue we had is bad classification of the new requirements (assignment to wrong categories or wrong developers). We tried to overcome this by using new requirements in the model training process generated using ChatGPT (as done in the collaboration with MDU in the Linz Hackathon). The results were not completely satisfactory, but the new avenue for research was opened and we expect to delve upon it in the final months of AIDOaRt.",4,3,4,The architecture is extremely abstract which is very good for extensibility (it is not tied to any particular usage or use case) but makes it a bit imprecise to adapt to concrete problems: new developments can be easily mapped but how the AIDOaRt approach helps is often difficult to pinpoint. It can nevertheless be adapted to concrete scenarios in the future (so extensibility is good) but there are few lessons learned from the architectural point of view.,4,"The structure is pretty clear and as mentioned, makes for easy extensions to the approach.",2,"No, the collaborations are better spotted from inspecting the details of the solutions and use cases. Mapping to particular elements in the architecture can help to find related elements, but always from a very high abstraction level which is often not so useful.",4,"Iterative approaches are often very helpful in unexplored environments so it has worked well in a complex project such as AIDOaRt, we have appreciated it. It also helped much to understand the MDE derived process with Modelio: the first months seemed like training but now changes to the model would be much faster.",3,"Since the architecture is defined from a very high abstraction level, the interfaces are defined also in a very generic manner. It is difficult to combine this approach with the more hands-on work on the software that is often required, e.g., to formalize concrete APIs and interfaces between components.",4,"Very useful from the project point of view, not so useful perhaps from an operational point of view (e.g., for a commercial product).",Yes,"It was similar to producing test/evaluation solutions to our commercial software. Small, incremental features were developed and then tested in more realistic environments.",Maybe,"We have developed some solutions (one effectively registered as an AIDOaRt solution [HIB_logAnalyzer], others as experiments not fully modelled in Modelio). The experience has been quite similar, Modelio did not add any difficulty (or benefit) to the solution that was integrated there. If we have used cross-partner solutions we feel like the experience would have been different, with Modelio modelling and adherence to the AIDOaRt architecture providing a good baseline to describe the collaboration.",Yes,"We used Modelio as a generic MDE tool and the experience was good but not necessarily useful for products in the scale of an SME, although we feel it may be very useful for larger products in which there is for example a large family of related variants.

We also used our own solutions to solve our own challenges.","It's been very interesting from the perspective of a company that usually does not use MDE, but from a production standpoint it didn't feel like it added any benefit other than clarity documenting the process. The learning curve was quite steep in the beginning and it clearly required a large effort from the side of the developers of Modelio as well as our own developers.","We proposed a tool (HIB Requirements Analyzer) that was built informally insde that part of the architecture. It wasn't fully modelled in Modelio.

The experience was good, by clearly placing our solution in the overall architecture we ensured two collaborations (one informal with RISE, other exemplified in a challenge in the Linz Hackathon with MDU). They approached us because they understood our problem in the overall AIDOaRt landscape as something in the Requirements Engineering position.",AIDOaRt is oriented towards these DevOps phases but we feel they are used a common theoretical framework but less rigidly than in other projects in which we have done R&D on DevOps. This makes for easier integration.,"We have used strongly AI techniques in all of our solutions and we have felt that AIDOaRt has been a good environment to work in the field. Good ideas and teams are abundant and the hackathon and F2F meeting enabled us to have interesting collaborations. We are also impressed by the considerable knowledge captured in the state of the art study in WP3, which is a good starting point to find solutions.","We feel like work in this are has been way less intense during AIDOaRt that other aspects (AI, DevOps, MDE, etc.). Not a lot of emphasis has been put on common data representations or joint generation of datasets.",We feel like this has been empowered quite late in the project (by the production of the catalog in the final months). We believed this is a key result and tried to instantiate it earlier -- we pushed for it quite hard during the production of D5.2 but it wasn't agreed to be produced at that stage.,"The project maybe has felt a bit like 'islands of research' rather than a unified effort. This approach is useful because you let the teams work at their own pace and generate interesting detailed results, but maybe a separate track to produce a 'AIDOaRt integrated prototype' that encapsulated a bit more comprehensively the results, integrating efforts from several of these 'islands' could have been useful. Even if it was solving a quite artificial problem it could have been an exemplary result that made easier to understand what is AIDOaRt as a whole.","We produced a useful collaboration with MDU in the last Hackathon in Linz that we could take further, using generative AI to produce requirements for NLP model training. This could be a solution for many SMEs to enlarge otherwise small datasets. This could be extended in the future."
2024/04/02 3:15:35 pm EET,xxxxxx@xxx.xxx,xxxxxx,Use case provider,WP1 - Use Cases Analysis and AIDOaRT Solution Architecture;WP4 - AIDOaRT AI-augmented toolkit;WP5 - Integration and Use Case Evaluation;WP6 - Dissemination and Exploitation,SME Industry,None,None,1-3 years,xxxxxx,Automotive,Technological achievements;Cooperations or collaborations,Configuration of radar sensors and modelling the configuration properties (including description and restrains) that can be used for automated testing process. This was solved together with solution provider (ABO) after many iterations and experiments.,Power measurement accuracy sorted out by smart synchronization of radar control and current measurement data collection.,3,3,4,,3,,3,,3,,4,,4,,No,,Yes,It was quite easy thank to good definition of API.,Yes,It was all automated so it was easy.,We got a new valuable experience from the area of modelling and MDE (modelling our radar configuration approach).,Requirements engineering regarding our radar configuration approach were quite important part that speed up development of our UC.,We applied this approach during iterations of integration ABO solution together with our radar configuration approach. This helped us to finally solve some issues we had on both sides.,Intelligence automation was another part of radar configuration solution together with STGEM solution in order to test as many hypothesis as possible.,"We have just a little data that we provided to STGEM solution, but these were very crucial. Common data format definition at the beginning was very important as well.",AIDOaRt framework was very important during the whole development process of our UC (including use of STGEM for radar configuration).,,"Collaboration with ABO was very important (applied for contribution on our broadcast request). With their STGEM solution, we were able to get lower power consumption of the radar with the same quality."
2024/04/03 4:11:23 pm EET,xxxxxx@xxx.xxx,xxxxxx,Solution provider,WP1 - Use Cases Analysis and AIDOaRT Solution Architecture;WP2 - AIDoaRT Data Collection and Representation;WP3 - AIDOaRT Infrastructure and Framework;WP4 - AIDOaRT AI-augmented toolkit;WP5 - Integration and Use Case Evaluation;WP6 - Dissemination and Exploitation;WP7 - Project Management and Coordination,SME Industry,3-5 years,5-10 years,1-3 years,xxxxxx,Automotive,Technological achievements;New knowledge,"Test Automation, Data encryption, data decryption.",Hardware board documentation during integration phase.,4,4,5,The architecture it's easy and fast to understand,5,No comment,5,No comment,4,No comment,5,No comment,4,No comment,Yes,We improved our skill in this sector,No,,Yes,Facilitates testing and encryption,"We improved our skill working on ""Modeling and Model-Driven Engineering"" in AIDOaRt","We improved our skill working on ""Requirements Engineering"" in AIDOaRt","We improved our skill working on ""Continuous Software and System Engineering"" in AIDOaRt","We improved our skill working on ""Intelligence and Automation"" in AIDOaRt",We have known new data standards,We have known framework facilities developing the solution in AIDOaRt project,,We achieved excellent results and met new partners. Therefore we plan to collaborate again with the UseCase leader and with the other partners who were part of the project.
2024/04/03 6:11:52 pm EET,xxxxxx@xxx.xxx,xxxxxx,Solution provider,WP4 - AIDOaRT AI-augmented toolkit,University,3-5 years,3-5 years,3-5 years,xxxxxx,Automotive,Technological achievements;Cooperations or collaborations,"Some issues to let the tool be more usable and less in prototype shape. We worked on using specific technology to facilitate the usability, like Docker.
","I do not encountered many blocking issues, just learning something about new tools to ease the integration of tools.",5,4,4,"I can talk relatively to my UC, the architecture was pretty clear and we understood how to inject our tool, considering the request of the UCP. According to the time required to learn and understand it, I believe that it can be extended outside the project.",4,,2,We relied more on the human interaction to identify the collaborations.,3,,4,,4,,Yes,"It was a good experience, since I come from academia. Therefore, working jointly with industry partner posed some interesting challenges. Understanding how to solve and fulfill specific needs.",Yes,"We worked to let our tool more usable and integrated, we decided to produce a container of the tool to facilitate so.",No,,Since I already have some expertise in model-driven engineering I found myself at home in some sense.,I cannot judge,From my perspective I'd say good.,"We applied succesfully technology based on machine learning. Therefore, I can say that the overall experience was good.","We had some issues with data that needed additional effort, due to data peculiarity.","I thinks good, I felt guided during the development.",I think the best way to improve the quality is to continue the work started with partners in the new edition of AIDOaRt.,Yes it did. During our multi-teams discussions we explored the will to continue the collaboration and we all agreed.
