2024/03/11 7:15:09 pm EET,xxxxxx@xxx.xxx,xxxxxx,Solution provider,WP1 - Use Cases Analysis and AIDOaRT Solution Architecture;WP2 - AIDoaRT Data Collection and Representation;WP3 - AIDOaRT Infrastructure and Framework;WP4 - AIDOaRT AI-augmented toolkit;WP5 - Integration and Use Case Evaluation;WP6 - Dissemination and Exploitation,SME Industry,5-10 years,5-10 years,1-3 years,xxxxxx,Maritime;Manufacturing;Industrial (Renewable energies),Industrial applications;Improvements in competence or experience;New knowledge;Cooperations or collaborations,"Specific positoning solution with convergence of several tight requirements (cost, accuracy, reliability, suitability to cloud computing architectures); adquire sufficiently expertise to offer exploitable AI/DL based services on the monitoring solutions; envisage of potential applicaiton of DL to more productive embedded SW validation","Lact of data. Even use case providers have difficutlties to access actual data stackeholders. The project organizaiton itself was a big experiment on new ways to collect, reflect and gather the information, and to organize the work, with nice outcomes. But it was different and new in comparison to our previous experiences. It required many teaching and meetings articulated by the core team. A big effort from their size too, which helped a lot the rest of the partners to adapt and get used. We also provided feedback to tries to adjusts some procedures to a more practical approach. I would say overall the result and the working atmosphere (ver, very important too) was very satisfactory.",4,3,3,"I think the architecture draw is synthetic as it is required at the initial touch. A deep understanding required the text related definitions. Even in that case, there are some aspects that can lead to discrepancies or ambiguities (e.g. why explainability service is not in the AI- augmented toolset, which are the differences between data management in data layer and data handling capabilites). On the other hand, those ambiguities can help to adoption by third parties adding specific semantics (in the same way stereotypes do in UML. However, such extension needs consensus, or at least, a careful understanding of a the semantics previosuly defined in AIDOaRt to avoid semantic clashes. ",3,"Not sure. I see as a way to structure information and procedures. Ordering things always help to a clearer and more efficeint work. However, not so sure if a more conventional working way would have not been equally efficient.",3,"We believe that likely yes to other partners. We did not spent much time on it honestly becasue we worked a lot the collaboration with partners at the proposal phase. That eliminates risks and helps for the very first moment. We found more collaboration after work in hackathons, and after partners presentations and interactions at the plenary. The time when the ptential collaborations were identified was likely late for doing something  in AIDOaRt withoug risking the already running collaborations, already effort and time demanding.",5,"Sure. At least we notice it once we could use hackathons to develop different parts of the targeted developments/demonstrators, from conception phase, to final implementations (with Mock Ups, and different demo versions in the middle)",3,"Formalization always help. The point is that from the initial conception towards their final shape, they can vary a lot. In that extend,  using Modelio formalization was used for the first statement, but not for the refined versions I would say. ",2,I would not say we rely on them,Yes,"Nothing different from other ECSEL/KDT projects. The main focus was on our Industrial positioning monitoring solution, which required close collaboration with partners, specially use case provider, and which was always beneficial. ",Maybe,"In principle, we develop solutions oriented to explitations (Services to customer), and tooling for own better productivity, both scenariosn which difficult we integrate the tool or open code. However, it is always beneficial for us integrate the solutions and tools in a ""catalog way"" to be part and let know ACORDE as a EU players with those capabilities.",Maybe,"We opened a new collaboration with ITI, to help them develop an assessment methodology/tool based on their previous development and that can be interesting for assessing new gateway configurations before they are actually deployed.","Good for initial sketching, also for Deliverable former sketching. There are nice features for collaborative modelling. However, the learning curve in a collaborative environment is a big barrier. Not all the people will advance and learn at the same pace, and that also creates additional issues. Moreover, the update of the collaborative model can be a bigger isse in some cases. A clear case is documentation. Feedback from text to model is not straightfoward, nor compatibility with edition tools. ","We have no experience on that, nor we applied much of it. ","This is definitely a hot topic, and unfortunatelly we could not eventually advance much on it in this project, as we found the already commited research, plus the collaboration oportunities open very demanding.","Very good experiences, which confirm the high potential to exploit AI and specifically DL technologies on different type of scenarios relevant for the compant (e.g. monitoring solitions in computing continuum, or virtual platform based design)","We used MDE to document data models, but likely did not fully exploited MDE tooling for other data aspects like data reformating. For that we fould suitable non-MDE applications, which take their configuration files.",Good as a reference framework,"When it comes to project management tools, e.g. meeting,  documentation, etc, an idea could be to let compete new experimental solutions with conventional solutions. Partners will feel free to choose, and new solutions will need to ensure cover conventional features and give added value to get adoption within the project flow. I also suggest shorter plenaries, to let have hackathons in separated clusters, at least once they are clarified (manye not in the 2 former plenaries). Hackathon results could be presened in the plenaries.","Sure. As said, we already worked a lot in the collaboration with some partners, e.g. Prodevelop, at the proposal phase, and AIDOaRt has serve to improve and reinforece a lot that collaboration. The collaboration in the project serve to launch other collaborations, (e.g. ITI) and to further now other companies, institutions and their fields, which is highly considered for furhter potential collaborations."
2024/03/12 3:24:10 pm EET,xxxxxx@xxx.xxx,xxxxxx,Solution provider,WP1 - Use Cases Analysis and AIDOaRT Solution Architecture;WP2 - AIDoaRT Data Collection and Representation;WP3 - AIDOaRT Infrastructure and Framework;WP5 - Integration and Use Case Evaluation;WP6 - Dissemination and Exploitation;WP7 - Project Management and Coordination,University,5-10 years,20-30 years,3-5 years,xxxxxx,Maritime,Industrial applications;Technological achievements;Improvements in competence or experience;Cooperations or collaborations,"Access to actual data was challenging, and adapt it to a processable structure. In tight collaboration with the UC provider, we agreed on a shared data model in order to proceed with the data analysis.",,5,5,5,,5,,5,The AIDOaRt generic meta-model helped identify potential collaborations between two partners who were interested in the same topic/area of logging analysis.,5,,5,,5,,Yes,,Yes,,Yes,,"MDE is our core skill, and developing using this approach helped us in escalating the solution we were integrating.",MBRE helped in centralizing and instrumentalizing the UC requirements. The shared understanding of the different use cases and their end-to-end traceability with the final tools/solutions are key benefits from it.,--,--,We participated in the definition of the AIDOaRt mega-model. The exercise of generalizing the concepts of the different UC data models was exhausting but led to a unified data representation across the diverse AIDOaRt development phases. It helps in understanding the domain concepts of the whole framework and provides traceability with the concrete use cases and UC data models.,The framework provided a scope and a systematic approach to the diverse development phases and domains considered. The structure of the framework and its materialization in actual tools/solutions and their application to use cases allow users to (1) easily identify the different areas of the framework and application possibilities; and (2) identify and consider tool/solution alternatives that have demonstrated their usability in the industry.,,We are in conversations with two other partners (different than the partners we started collaborating with at the beginning of the project in a specific use case scenario) to help them model the data structure of a shared topic of interest.
2024/03/13 1:20:46 pm EET,xxxxxx@xxx.xxx,xxxxxx,Solution provider,WP2 - AIDoaRT Data Collection and Representation;WP3 - AIDOaRT Infrastructure and Framework;WP4 - AIDOaRT AI-augmented toolkit,Research Institute,3-5 years,1-3 years,3-5 years,xxxxxx,Construction;Manufacturing,Industrial applications;Cooperations or collaborations;Publications,"1)* Lack of real data*. To solve this problem, we, with the help of other partners, are creating synthetic data that mimic the actual UCPs data.

2) Combine different solutions. The main solution that I worked on was based on the EMF technology stack, while some other partners' solutions were not. To pass through it, we need to add extra layers of development to convert and transform the data and help with the integration.

3) *Publish results in scientific conferences*. It was hard to convince external evaluators of the value of the combined solution without the whole context of the AIDOaRt project (due mostly to space limitations). We overcame this challenge by collaborating to adjust and refine the final papers and reports.",,4,3,5,,3,,5,,4,,2,,3,,Yes,Developing a solution in the context of a project like AIDOaRt is an experience different from other development environments since it needs to be aligned with too many partners and attend to the desired UCP's KPIs simultaneously.,No,,Yes,"Besides the solution that was developed, I also used some of the other partners' (SPs) tools, which demonstrated the project's value to help in collaboration for huge projects.","I learned a lot about MDE during my work on the AIDOaRt project and use cases. Now, I'm much more informed about its potential applications in real cases, especially when dealing with huge projects.",I didn't work directly with RE during AIDOaRt project,I didn't work directly with Continuous Software and System Engineering during AIDOaRt project.,"My experience and knowledge about AI and automation increased greatly during my work with AIDOaRt, and I had no bad experience with this subject.","I think the Data collection was done well, but it lacks some real data from UCP to enable better integration work.","Although I didn't contribute directly to the framework definition, I think it was a good job since all the information (and there is a lot of information) was correctly gathered and made available both internally to the partners and externally.",I think the data collection from use cases can be improved by establishing a minimum amount of data that UCP should provide to the SP to enable and improve the work dealing with real scenarios coming directly from the project's industrial partners.,"After the work with AIDOaRt, there's clear room for work combining MDE and AI in many different ways. So, future work will probably go in this direction.

The main collaboration in my perspective (being the developer of IMTA solutions) is to keep the collaboration achieved during the Hackathon, both with other SP partners and also UCP partners."
2024/03/13 3:25:41 pm EET,xxxxxx@xxx.xxx,xxxxxx,Solution provider,WP4 - AIDOaRT AI-augmented toolkit;WP5 - Integration and Use Case Evaluation;WP6 - Dissemination and Exploitation,Research Institute,3-5 years,None,5-10 years,xxxxxx,Manufacturing,Technological achievements;New knowledge,#NOME?,,3,3,3,,3,,2,,3,,4,,3,,Yes,It has been a great experience working with the UC provider as we constantly got the feedback to improve and define the solution,Maybe,,No,,N/A,The use case requirements in WP1 led to the development and refinement of the tool developed for UC provider.,N/A,A great experience. The proposed AI methods in different UC solutions provided by multiple solution provider increase the pool of knowledge.,The AIDOaRt datamodel helped understanding the collection of logs/events from CPS. Also the data metamodel gave an holistic view of the data collection and representation phase.,The framework helped in understanding the complete picture of solutions proposed in AIDOaRt and how they should be linked to core infrastructure of AIDOaRt. ,,"Yes, it led to collaborating with other PhD students in joint publications."
2024/03/13 3:31:31 pm EET,xxxxxx@xxx.xxx,xxxxxx,Solution provider,WP3 - AIDOaRT Infrastructure and Framework;WP4 - AIDOaRT AI-augmented toolkit,University,1-3 years,15-20 years,None,xxxxxx,Construction;Manufacturing;many MDE solutions are domain-agnostic,New knowledge;Cooperations or collaborations;Publications,"Challenge 1: Defining an appropriate engineering workflow that allows previously isolated tools to interoperate. Many solutions are academic tools with potential limitation to be discovered in challenging industrial settings. From a technical, modeld-driven perspective, the solution consists in identifying one or more common technological context/space (Ts). For JKU, this TS is the Eclipse Modeling Framework and related technologies, we worked on promoting the integration through EMF.

Challenge 2: Organizational challenges are pivotal. For the development and integration of solutions, the presence of stable teams is crucial. Typically, research outcomes from PhD students constitute the academic system and technical contributions in EU projects. Consequently, the development, utilization, and integration of such solutions are at a higher risk due to the transitory nature of these positions. While this issue is somewhat addressed at the project level, it invariably leads to complications in the medium to long term.

",See the answer to the previous question,3,3,3,"Is the AIDOaRt architecture clear and understandable? (e.g., all components are well described) : From a design-level perspective, it is understandable, given my previous knowledge of UML. 

Is the AIDOaRt architecture easy to use and explore? (e.g., easy to relate your UC requirements or solutions to the architecture components). Modelio helps in surfing the information. However, given the nature of the AIDOaRt framework as a collection of existing/extended solutions, the overall architecture and related documentation is only descriptive and can be subject to erosion when changes will come after the end on the project 

Do you believe the architecture can be easily extended or used outside the scope of the AIDOaRt project? AIDOaRt is an extensive framework encompassing numerous solutions. I anticipate that an expansion could apply to a subset of the AIDOaRt solutions that have contributed to resolving a specific use case. However, it is improbable that an expansion would pertain to the entire AIDOaRt project.
",3,"It helps to provide an overview as a descriptive artifact. As such, it cannot help in specific technical tasks since it remains too generic and too big.",5,"Definitely, it helps to justify collaborations in AIDOaRt",2,"As explained above, it helps to provide a unifying viewpoint and establish potential relationships. A direct impact on the implementation can only be achieved with prescriptive models/artifacts that can be used directly in the implementation process (e.g., code generation). This is not the case, and it is actually not meant to be a prescriptive model.",2,See above,2,see above,Yes,"My experience is on using technologies related to the Eclipse Modeling Framework, in particular, metamodel(ing), model(ing), and model transformations for integration purposes",Yes,A good experience in particular if related to the VCE Use Case as documented in the related publication https://www.researchgate.net/publication/378148318_Towards_Automating_Model-Based_Systems_Engineering_in_Industry_-_An_Experience_Report,Yes,See the publication https://www.researchgate.net/publication/378148318_Towards_Automating_Model-Based_Systems_Engineering_in_Industry_-_An_Experience_Report,Very Good,Not so good,Good,Fair,n.a.,Good (limited to the VCE Use Case and related/integrated tools),"The AIDOaRt framework is too big. Explicit integration points should be clearly stated at the very beginning and related utilities be implemented for easier integration. Without those capabilities, many tools remained unrelated, resulting in islands of tools rather than a connected network ",Sure. We are participating in follow-up projects like AIDOSec.
2024/03/14 5:06:50 pm EET,xxxxxx@xxx.xxx,xxxxxx,Solution provider,WP1 - Use Cases Analysis and AIDOaRT Solution Architecture;WP2 - AIDoaRT Data Collection and Representation;WP3 - AIDOaRT Infrastructure and Framework;WP4 - AIDOaRT AI-augmented toolkit;WP5 - Integration and Use Case Evaluation;WP6 - Dissemination and Exploitation;WP7 - Project Management and Coordination,University,1-3 years,1-3 years,5-10 years,xxxxxx,Digital Life,Technological achievements;Improvements in competence or experience;New knowledge;Cooperations or collaborations;Publications,"One of the main challenges was to handle complexity and ambiguity in natural language understanding. To overcome this challenge, in ReqH iterative refinement of the developed algorithms helped improve the accuracy and robustness of the translation process. One challenge in NNVer's development was optimizing the effectiveness of ""step-zero object detection"" networks alongside intricate NNs. This was overcome through rigorous experimentation, parameter tuning, and collaborative refinement to ensure compatibility and reliability.",,5,5,5,"The clarity and understandability of the AIDOaRt architecture depend on how well its components are described and documented. I think that all components are clearly defined and their interactions are well-explained, thus users should be able to comprehend the architecture easily.",5,,5,,5,,5,,5,,Yes,"Developing solutions within the AIDOaRt framework provided a structured approach, facilitating integration with other components.",Yes,Collaboration with the use case was crucial for ensuring integration. ,Yes,,"MDE provided benefits like abstraction for focusing on system behavior, tool support for productivity, and improved communication among stakeholders.",Requirements Engineering in AIDOaRt was crucial for eliciting and documenting the needs of UC and solution providers. ,"It fosters rapid iteration and deployment cycles, enhancing agility and system reliability. However, challenges may arise in maintaining synchronization between development, testing, since it requires robust coordination and automation strategies for optimal outcomes.","Leveraging Intelligence and Automation has brought positive outcomes through the adoption of new AI methods and applications, enhancing solution capabilities and efficiency.","It helped to establish formats and protocols for data, thus facilitating collaboration.",AIDOaRt framework serves as a foundational structure that both facilitates and guides the development of solutions.,,"Yes, AIDOaRt has stimulated the emergence of new ideas and potential collaborations  through hackathons events and continuous interactions. Potential collaborations include joint research projects, technology transfer partnerships, knowledge sharing initiatives, and consortium building. "
2024/03/18 4:44:18 pm EET,xxxxxx@xxx.xxx,xxxxxx,Solution provider,WP1 - Use Cases Analysis and AIDOaRT Solution Architecture;WP2 - AIDoaRT Data Collection and Representation;WP3 - AIDOaRT Infrastructure and Framework;WP4 - AIDOaRT AI-augmented toolkit;WP5 - Integration and Use Case Evaluation;WP6 - Dissemination and Exploitation;WP7 - Project Management and Coordination,University,1-3 years,1-3 years,1-3 years,xxxxxx,Automotive,Industrial applications;Technological achievements;New knowledge;Technical speed-up;Publications,"One of the main challenges when using passive learning is identifying and mitigating limitations of the used algorithms. More specifically, in the RDE use case of AVL we were challenged by the fact that only a small number of (albeit long) data traces is available. This is a case in which the performance of learning algorithms such as IOAlergia deteriorates. To overcome this problem, we developed a novel method that uses domain knowledge to split the learning problem into smaller problems with more but shorter data traces. This is done in a way that allows recombining the solutions of the sub problems into a solution for the overall problem.

A common challenge related to the use and integration of active automata learning is developing a suitable abstraction of the system under learning (SUL). Such an abstraction needs to be weak enough to cover interesting behavior while being strong enough to keep learning tractable by avoiding redundant exploration of similar and uninteresting behaviors. This also applies to the MBT use case of AVL in which we model the behavior of an Advanced Driver-Assistance System (ADAS) in response to changes of the environment. In this case the abstraction has to avoid violations of the operational domain of the ADAS function, including safety violations caused by environment-controlled vehicles. This was achieved by encoding domain constraints and caching violations. This also requires interaction with the simulation environment, which is a non-negligible engineering effort.",,3,2,3,"It appears to me, that the granularity of the AIDOaRt framework is not overly consistent. At times it is extremely abstract while other aspects are covered in much more detail. Take for example data handling which has its own tool set while also being sported in the core and AIOPS Engineering tool sets, where the differences are not clearly delineated. The formalisms and models of AI in contrast are referenced directly only in Engagement & Analysis and indirectly in AI DevOps Engineering.",2,,4,,1,Requirements were known beforehand,3,,3,,Yes,"Our vision for the tool was relatively clear. Therefore, the development process was also relatively straight forward.",Maybe,"For AVL's MBT UC, we integrated AALpy with a simulation environment from the automotive domain. This required carefully choosing the right level of abstraction for active automata learning methods to be applicable as well as some engineering effort for hooking together AALpy and the simulation environment. As usual, the abstraction process required some iterations. The engineering part was relatively smooth.",Yes,,"The use of Modelio was mostly pleasant. However, it could have been utilized better. We sometimes rereported things that were either already present in Modelio or where the data in Modelio could have served as a baseline. At times the models got a bit too contrived (in relation to visualization capabilities) to see what is present in the model and what not and how things relate to each other.",I was not involved.,None.,We mainly developed and applied our own methods.,Limited data availability and quality was definitely an issue.,"The relation to the AIDOaRt framework was often trivial, since we knew what we wanted to implement and specified that in the framework beforehand.",,Not really.
2024/03/22 10:46:07 am EET,xxxxxx@xxx.xxx,xxxxxx,Solution provider,WP4 - AIDOaRT AI-augmented toolkit;WP5 - Integration and Use Case Evaluation;WP6 - Dissemination and Exploitation;WP7 - Project Management and Coordination,Research Institute,5-10 years,1-3 years,5-10 years,xxxxxx,Railway;Manufacturing,Industrial applications;Improvements in competence or experience;New knowledge,real problem application,,4,4,4,,4,,4,,4,,4,,4,,Yes,,Maybe,,Maybe,,Not really related,Not related,Application of real industrial problem,Good application in real industrial context.,Good use of industrial data.,Good overview of different tools and use cases.,,Identified new idea for future work 
